{
  "exception_id": "exc_0001",
  "created_at": "2026-01-10T12:00:00Z",
  "expires_at": "2026-12-31T12:00:00Z",
  "owner_id": "team.platform",
  "control_ids": ["AEC-04"],
  "justification": "Approval latency SLO pending; using manual fallback until metric pipeline is live.",
  "status": "approved",
  "reviewed_at": "2026-01-10T12:10:00Z",
  "reviewer_id": "user.security",
  "mitigation": "Manual approval required; deployment window restricted.",
  "ticket_ref": "JIRA-1234"
}
